role,name,affiliation,address,trial_id,processed_name,first_name,gender,gender_probability,gender_sample_count,Rank,Title,Status,Study Results,Conditions,Interventions,Sponsor/Collaborators,Other IDs,First Posted,Locations,URL
Principal Investigator,José Perez,MedSIR,,NCT03809988,josé perez,josé,male,0.97,2086,529,PALbociclib Rechallenge in horMone Receptor-posItive/HER2- Negative Advanced Breast Cancer (PALMIRA),Recruiting,No Results Available,Breast Cancer|Advanced Breast Cancer|Hormone Receptor Positive Tumor|Human Epidermal Growth Factor 2 Negative Carcinoma of Breast,Drug: Palbociclib|Drug: Endocrine therapy,MedSIR|Pfizer,MedOPP068,"January 18, 2019","Hôpital Jean Minjoz, Besançon, France|Centre Georges François Leclerc, Dijon, France|Chd-Vendee, La Roche-sur-Yon, France|APHP Tenon, Paris, France|George Pompidou European Hospital, Paris, France|Centre Paul Strauss, Strasbourg, France|ICO Badalona, Badalona, Barcelona, Spain|Hospital Provincial de Castellón, Castello, Castelló, Spain|Consorci Sanitari de Terrassa, Terrassa, Terrasa, Spain|Centro Oncológico de Galicia, A Coruña, Spain|Institut Català d'Oncologia Bellvitge, Barcelona, Spain|H. Vall Hebrón, Barcelona, Spain|Hospital del Mar, Barcelona, Spain|Hospital de Basurto, Bilbao, Spain|Hospital San Pedro de Alcantara, Cáceres, Spain|Institut Català d'Oncologia, Girona, Spain|Hospital Arnau de Vilanova, Lleida, Spain|Hospital Clinico San Carlos, Madrid, Spain|Hospital Universitario Sanchinarro, Madrid, Spain|Hospital La Paz, Madrid, Spain|Hospital Regional Universitario de Malaga, Málaga, Spain|Hospital Universitari Son Espases, Palma De Mallorca, Spain|Hospital Sant Joan, Reus, Spain|Hospital Universitario Virgen de la Macarena, Sevilla, Spain|Hospital Universitario Virgen del Rocío, Sevilla, Spain|Instituto Valenciano de Oncología IVO, Valencia, Spain|Hospital General Universitari de Valencia, Valencia, Spain|Hospital Arnau de Vilanova de Valencia, Valencia, Spain|Hospital Universitari i Politecnic La Fe, Valencia, Spain|Hospital Álvaro Cunqueiro, Vigo, Spain|Hospital Lozano Blesa, Zaragoza, Spain|Hospital Miguel Servet, Zaragoza, Spain|Beatson West of Scotland Cancer Center, Glasgow, United Kingdom|Barts Cancer Institute, London, United Kingdom|Kent Oncology Department, Maidstone, United Kingdom|The Christie NHS Foundation Trust, Manchester, United Kingdom|Royal Cornwall Hospital NHS Trust, Truro, United Kingdom",https://ClinicalTrials.gov/show/NCT03809988
Principal Investigator,"Zahi Mitri, MD",OHSU Knight Cancer Institute,,NCT03801369,zahi mitri,zahi,male,0.9,489,530,Olaparib and Durvalumab to Treat Patients With Metastatic Triple Negative Breast Cancer,Recruiting,No Results Available,Metastatic Triple Negative Breast Cancer|Breast Cancer|ER-Negative PR-Negative HER2-Negative Breast Cancer|ER-Negative PR-Negative HER2-Negative Breast Neoplasms|Triple-Negative Breast Cancer|Triple Negative Breast Cancer|Triple-Negative Breast Neoplasm,Drug: Olaparib|Biological: Durvalumib,OHSU Knight Cancer Institute|Oregon Health and Science University,STUDY00018504,"January 11, 2019","OHSU Knight Cancer Institute, Portland, Oregon, United States",https://ClinicalTrials.gov/show/NCT03801369
Study Chair,"Glauco Baiocchi, MD, PhD",AC Camargo Cancer Center,,NCT04059809,glauco baiocchi,glauco,male,0.99,542,532,Photobiomodulation for Breast Cancer Radiodermatitis,Recruiting,No Results Available,Breast Cancer|Radiodermatitis|Radiotherapy Side Effect|Radiation Dermatitis|Radiation Toxicity|Radiation Injuries|Quality of Life|Breast Neoplasms,Device: Photobiomodulation,AC Camargo Cancer Center,2.777.676,"August 16, 2019","Universidade do Vale do Itajai - UNIVALI, Itajai, Santa Catarina, Brazil",https://ClinicalTrials.gov/show/NCT04059809
Principal Investigator,"Maryam B Lustberg, MD",Ohio State University Comprehensive Cancer Center,,NCT04205903,maryam b lustberg,maryam,female,0.98,9767,535,Nilotinib in Preventing Paclitaxel-Induced Peripheral Neuropathy in Patients With Stage I-III Breast Cancer,Recruiting,No Results Available,Anatomic Stage I Breast Cancer AJCC v8|Anatomic Stage IA Breast Cancer AJCC v8|Anatomic Stage IB Breast Cancer AJCC v8|Anatomic Stage II Breast Cancer AJCC v8|Anatomic Stage IIA Breast Cancer AJCC v8|Anatomic Stage IIB Breast Cancer AJCC v8|Anatomic Stage III Breast Cancer AJCC v8|Anatomic Stage IIIA Breast Cancer AJCC v8|Anatomic Stage IIIB Breast Cancer AJCC v8|Anatomic Stage IIIC Breast Cancer AJCC v8|Prognostic Stage I Breast Cancer AJCC v8|Prognostic Stage IA Breast Cancer AJCC v8|Prognostic Stage IB Breast Cancer AJCC v8|Prognostic Stage II Breast Cancer AJCC v8|Prognostic Stage IIA Breast Cancer AJCC v8|Prognostic Stage IIB Breast Cancer AJCC v8|Prognostic Stage III Breast Cancer AJCC v8|Prognostic Stage IIIA Breast Cancer AJCC v8|Prognostic Stage IIIB Breast Cancer AJCC v8|Prognostic Stage IIIC Breast Cancer AJCC v8,Drug: Nilotinib|Drug: Nilotinib Hydrochloride Monohydrate|Drug: Paclitaxel|Other: Placebo|Other: Questionnaire Administration,Ohio State University Comprehensive Cancer Center|National Cancer Institute (NCI),OSU-18317|NCI-2019-03146|P30CA016058|R01CA238946,"December 20, 2019","Ohio State University Comprehensive Cancer Center, Columbus, Ohio, United States",https://ClinicalTrials.gov/show/NCT04205903
Principal Investigator,"Maryam B Lustberg, MD",Ohio State University Comprehensive Cancer Center,,NCT04205071,maryam b lustberg,maryam,female,0.98,9767,636,Lorcaserin in Treating Chemotherapy-Induced Peripheral Neuropathy in Patients With Stage I-IV Gastrointestinal or Breast Cancer,Not yet recruiting,No Results Available,Anatomic Stage I Breast Cancer AJCC v8|Anatomic Stage IA Breast Cancer AJCC v8|Anatomic Stage IB Breast Cancer AJCC v8|Anatomic Stage II Breast Cancer AJCC v8|Anatomic Stage IIA Breast Cancer AJCC v8|Anatomic Stage IIB Breast Cancer AJCC v8|Anatomic Stage III Breast Cancer AJCC v8|Anatomic Stage IIIA Breast Cancer AJCC v8|Anatomic Stage IIIB Breast Cancer AJCC v8|Anatomic Stage IIIC Breast Cancer AJCC v8|Anatomic Stage IV Breast Cancer AJCC v8|Chemotherapy-Induced Peripheral Neuropathy|Digestive System Carcinoma|Prognostic Stage I Breast Cancer AJCC v8|Prognostic Stage IA Breast Cancer AJCC v8|Prognostic Stage IB Breast Cancer AJCC v8|Prognostic Stage II Breast Cancer AJCC v8|Prognostic Stage IIA Breast Cancer AJCC v8|Prognostic Stage IIB Breast Cancer AJCC v8|Prognostic Stage III Breast Cancer AJCC v8|Prognostic Stage IIIA Breast Cancer AJCC v8|Prognostic Stage IIIB Breast Cancer AJCC v8|Prognostic Stage IIIC Breast Cancer AJCC v8|Prognostic Stage IV Breast Cancer AJCC v8,Drug: Lorcaserin|Drug: Lorcaserin Hydrochloride|Other: Questionnaire Administration,Ohio State University Comprehensive Cancer Center|National Cancer Institute (NCI),OSU-19085|NCI-2019-03368|P30CA016058,"December 19, 2019","Ohio State University Comprehensive Cancer Center, Columbus, Ohio, United States",https://ClinicalTrials.gov/show/NCT04205071
Principal Investigator,Banu Arun,M.D. Anderson Cancer Center,,NCT04090567,banu arun,banu,female,0.93,6694,536,Olaparib With Cediranib or AZD6738 for the Treatment of Advanced or Metastatic Germline BRCA Mutated Breast Cancer,Not yet recruiting,No Results Available,Advanced Breast Carcinoma|Anatomic Stage III Breast Cancer AJCC v8|Anatomic Stage IIIA Breast Cancer AJCC v8|Anatomic Stage IIIB Breast Cancer AJCC v8|Anatomic Stage IIIC Breast Cancer AJCC v8|Anatomic Stage IV Breast Cancer AJCC v8|Germline BRCA1 Gene Mutation|Germline BRCA2 Gene Mutation|HER2/Neu Negative|Metastatic Breast Carcinoma|Prognostic Stage III Breast Cancer AJCC v8|Prognostic Stage IIIA Breast Cancer AJCC v8|Prognostic Stage IIIB Breast Cancer AJCC v8|Prognostic Stage IIIC Breast Cancer AJCC v8|Prognostic Stage IV Breast Cancer AJCC v8,Drug: Cediranib|Drug: Ceralasertib|Drug: Olaparib,M.D. Anderson Cancer Center|National Cancer Institute (NCI),2018-0062|NCI-2019-04148|P30CA016672,"September 16, 2019","M D Anderson Cancer Center, Houston, Texas, United States",https://ClinicalTrials.gov/show/NCT04090567
Study Director,Banu Dilek,Dokuz Eylul University,,NCT04213001,banu dilek,banu,female,0.93,6694,566,Diagnostic Contribution of Ultrasonography in Breast Cancer-Related Lymphedema,Completed,No Results Available,Lymphedema of Upper Arm,Diagnostic Test: ultrasonographic measurement,Dokuz Eylul University,DokuzEUBanuNihan,"December 30, 2019","Dokuz eylul university, İzmir, Inciralti, Turkey",https://ClinicalTrials.gov/show/NCT04213001
Principal Investigator,"Hope Rugo, MD","University of California, San Francisco",,NCT03971409,hope rugo,hope,female,0.69,3238,537,"Avelumab With Binimetinib, Utomilumab, or Anti-OX40 Antibody PF-04518600 in Treating Triple Negative Breast Cancer",Recruiting,No Results Available,Stage III Breast Cancer|Stage IIIA Breast Cancer|Stage IIIB Breast Cancer|Stage IIIC Breast Cancer|Stage IV Breast Cancer|Invasive Breast Carcinoma|Recurrent Breast Carcinoma|Triple-Negative Breast Carcinoma,Biological: Anti-OX40 Antibody PF-04518600|Drug: Avelumab|Drug: Binimetinib|Biological: Utomilumab,"Hope Rugo, MD|Translational Breast Cancer Research Consortium|Hoosier Cancer Research Network|Array BioPharma|Pfizer|Breast Cancer Research Foundation|Johns Hopkins University|University of California, San Francisco",187519|NCI-2019-01531|TBCRC 047|BRE16-279,"June 3, 2019","University of California, San Francisco, San Francisco, California, United States|Mayo Clinic, Rochester, Minnesota, United States|UNC Lineberger Comprehensive Cancer Center, Chapel Hill, North Carolina, United States|Vanderbilt University/Ingram Cancer Center, Nashville, Tennessee, United States",https://ClinicalTrials.gov/show/NCT03971409
Study Chair,"Chen Xi, PhD",Fuzhou General Hospital,,NCT04088110,chen xi,chen,male,0.62,5003,538,Pyrotinib Combined With Trastuzumab Plus Aromatase Inhibitor in Treatment of Breast Cancer,Not yet recruiting,No Results Available,Breast Cancer Female|HER2-positive Breast Cancer|Hormone Receptor Positive Malignant Neoplasm of Breast|Metastatic Breast Cancer|Breast Diseases|Hormone Receptor Positive Tumor,Drug: Pyrotinib|Drug: Trastuzumab|Drug: Aromatase Inhibitors,Fuzhou General Hospital,Arise-FJ-B102,"September 12, 2019","Fuzhou general hospital, Fuzhou, Fujian, China",https://ClinicalTrials.gov/show/NCT04088110
Principal Investigator,Rashmi Murthy,University of Texas MD Anderson Cancer Center LAO,,NCT04108858,rashmi murthy,rashmi,female,0.94,551,540,"Testing the Addition of an Anti-cancer Drug, Copanlisib, to the Usual Maintenance Treatment (Trastuzumab and Pertuzumab) After Initial Chemotherapy in a Phase Ib/II Trial for Advanced HER2 Positive Breast Cancer",Not yet recruiting,No Results Available,Anatomic Stage IV Breast Cancer AJCC v8|ERBB2 Gene Amplification|HER2 Positive Breast Carcinoma|Metastatic Breast Carcinoma|PIK3CA Gene Mutation|PTEN Gene Mutation,Drug: Copanlisib|Biological: Pertuzumab|Biological: Trastuzumab,National Cancer Institute (NCI),NCI-2019-06461|10296|UM1CA186688,"September 30, 2019",,https://ClinicalTrials.gov/show/NCT04108858
Principal Investigator,"Diane K Ehlers, PhD",University of Nebraska,,NCT03980626,diane k ehlers,diane,female,0.97,15367,541,Study on Physical Activity's Relationship With Cancer and Cognition,Recruiting,No Results Available,Breast Cancer|Breast Neoplasm Female,Behavioral: Walking,University of Nebraska,IRB091-19,"June 10, 2019","University of Nebraska Medical Center, Omaha, Nebraska, United States",https://ClinicalTrials.gov/show/NCT03980626
Principal Investigator,Aleksandr Obukhov,"A. Tsyb Medical Radiological Research Centre, (A. Tsyb MRRC), Obninsk, Russia",,NCT03970967,aleksandr obukhov,aleksandr,male,0.99,7354,542,Alpha Radiation Emitters Device for the Treatment of Newly Diagnosed Breast Carcinoma Patients With Distant Metastases,Recruiting,No Results Available,Breast Carcinoma|Metastatic Breast Cancer|Invasive Breast Cancer|Distant Metastases.Pathology,Device: Device: Radiation: Diffusing Alpha Radiation Emitters Therapy (DaRT),Alpha Tau Medical LTD.,CTP-BRST-01,"June 3, 2019","A. Tsyb Medical Radiological Research Center, Obninsk, Kaluga Region, Russian Federation",https://ClinicalTrials.gov/show/NCT03970967
Study Chair,Rob Crombie,Que Oncology,,NCT04080297,rob crombie,rob,male,0.98,32016,543,Dose Escalation Study in Female Subjects With Breast Cancer Receiving Aromatase Inhibitor or Tamoxifen,Completed,Has Results,Vasomotor Symptoms (VMS),Drug: oral capsule of Q-122,Que Oncology,Q-1001,"September 6, 2019",,https://ClinicalTrials.gov/show/NCT04080297
Study Chair,"Gulseren Akyuz, Prof",Marmara University,,NCT04138667,gulseren akyuz,gulseren,female,0.96,248,544,Responsiveness of Outcome Scales in Breast Cancer Related Lymphedema,Recruiting,No Results Available,Lymphedema of Upper Arm,Other: complex decongestive therapy,Marmara University,09.2019.865,"October 24, 2019","Marmara University School of Medicine Department of Physical Medicine and Rehabilitation, Istanbul, Turkey",https://ClinicalTrials.gov/show/NCT04138667
Principal Investigator,"Nele Adriaenssens, Prof. Dr.",Universitair Ziekenhuis Brussel,,NCT04125953,nele adriaenssens,nele,female,0.89,2771,545,Stochastic Modulated Vibrations on Autonomic Nervous System of Breast Cancer Patients During Radiotherapy,Recruiting,No Results Available,Autonomic Nervous System Imbalance|Psychological Distress|Cancer-related Pain|Breast Cancer Lymphedema|Quality of Life,Device: Andullation|Other: Placebo,Universitair Ziekenhuis Brussel,2018/455,"October 14, 2019","Universitair Ziekenhuis Brussel, Jette, Brussels, Belgium",https://ClinicalTrials.gov/show/NCT04125953
Principal Investigator,"Muriel Brackstone, PhD, MD",Lawson Health Research Institute,,NCT03868475,muriel brackstone,muriel,female,0.98,14732,790,Comparing Vacuum-Assisted Percutaneous Excision to Open Surgical Excision for Borderline or High-Risk Breast Lesions,Not yet recruiting,No Results Available,Breast Fibroadenoma|Atypical Ductal Hyperplasia|Atypical Lobular Hyperplasia|Lobular Carcinoma in Situ|Flat Epithelial Atypia|Phyllodes; Fibroadenoma|Phyllodes Breast Tumor|Radial Scar|Breast Papilloma|Complex Sclerosing Papillary Lesion of the Breast,Procedure: Vacuum-assisted percutaneous excision|Procedure: Open surgical excision,Lawson Health Research Institute,1,"March 11, 2019",,https://ClinicalTrials.gov/show/NCT03868475
Principal Investigator,Saranya Chumsri,Mayo Clinic,,NCT04197687,saranya chumsri,saranya,female,0.98,446,547,"TPIV100 and Sargramostim for the Treatment of HER2 Positive, Stage II-III Breast Cancer in Patients With Residual Disease After Chemotherapy and Surgery",Recruiting,No Results Available,Breast Adenocarcinoma|Stage II Breast Cancer AJCC v6 and v7|Stage IIA Breast Cancer AJCC v6 and v7|Stage IIB Breast Cancer AJCC v6 and v7|Stage III Breast Cancer AJCC v7|Stage IIIA Breast Cancer AJCC v7|Stage IIIB Breast Cancer AJCC v7|Stage IIIC Breast Cancer AJCC v7,Biological: Pertuzumab|Other: Placebo Administration|Biological: Sargramostim|Biological: Trastuzumab|Biological: Trastuzumab Emtansine|Biological: Vaccine Therapy,Mayo Clinic|National Cancer Institute (NCI),MC1835|NCI-2019-08038|P30CA015083,"December 13, 2019","Mayo Clinic Arizona, Phoenix, Arizona, United States|Mayo Clinic in Florida, Jacksonville, Florida, United States|Mayo Clinic, Rochester, Minnesota, United States",https://ClinicalTrials.gov/show/NCT04197687
Principal Investigator,Elizabeth C Dees,Duke University - Duke Cancer Institute LAO,,NCT03803761,elizabeth c dees,elizabeth,female,0.99,31288,549,"Study of a New Drug Combination, Copanlisib and Fulvestrant, in Postmenopausal Women With Advanced Breast Cancer",Not yet recruiting,No Results Available,Anatomic Stage IV Breast Cancer AJCC v8|Breast Carcinoma Metastatic in the Brain|Estrogen Receptor Positive|HER2/Neu Negative|Metastatic Breast Carcinoma|Postmenopausal|Prognostic Stage IV Breast Cancer AJCC v8,Drug: Copanlisib|Drug: Fulvestrant,National Cancer Institute (NCI),NCI-2019-00048|NCI10195|10195|UM1CA186704,"January 15, 2019",,https://ClinicalTrials.gov/show/NCT03803761
Study Director,"Elizabeth Olek, DO, MPH",Loxo Oncology,,NCT03899792,elizabeth olek,elizabeth,female,0.99,31288,824,A Study of Oral LOXO-292 in Pediatric Patients With Advanced Solid or Primary Central Nervous System Tumors,Recruiting,No Results Available,Medullary Thyroid Cancer|Infantile Myofibromatosis|Infantile Fibrosarcoma|Papillary Thyroid Cancer|Soft Tissue Sarcoma,Drug: LOXO-292,"Loxo Oncology, Inc.",LOXO-RET-18036|2019‐000212‐28,"April 2, 2019","Children's Hospital Los Angeles, Los Angeles, California, United States|Dana Farber Cancer Institute, Boston, Massachusetts, United States|Memorial Sloan Kettering Cancer Center, New York, New York, United States|Cincinnati Children's Hospital Medical Center, Cincinnati, Ohio, United States|Children's Hospital of Philadelphia, Philadelphia, Pennsylvania, United States|St. Jude Children's Research Hospital, Inc., Memphis, Tennessee, United States|University of Texas, Southwestern Medical Center, Dallas, Texas, United States|Texas Children's Hospital, Houston, Texas, United States|Seattle Children's Hospital, Seattle, Washington, United States",https://ClinicalTrials.gov/show/NCT03899792
Study Director,Jutta Hänninen,"Orion Corporation, Orion Pharma",,NCT03878823,jutta hänninen,jutta,female,0.97,3872,551,Safety and Pharmacokinetics of ODM-209,Recruiting,No Results Available,Prostate Cancer Metastatic|Advanced Breast Cancer|Castration-resistant Prostate Cancer|Metastatic Breast Cancer,Drug: ODM-209,"Orion Corporation, Orion Pharma",3125001,"March 18, 2019","Rigshospitalet, University Hospital of Copenhagen, Copenhagen, Denmark|Helsinki University Central Hospital, Helsinki, Finland|Tampere University Hospital, Tampere, Finland|Institut Gustave Roussy, Villejuif, France",https://ClinicalTrials.gov/show/NCT03878823
Principal Investigator,"Alejandra Hurtado de Mendoza, PhD",Georgetown University,,NCT03959267,alejandra hurtado de mendoza,alejandra,female,0.98,16369,552,Testing a Culturally Adapted Telephone Genetic Counseling Intervention,Recruiting,No Results Available,Breast Cancer|Hereditary Breast Cancer,Behavioral: Telephone Genetic Counseling,Georgetown University|Hackensack Meridian Health,KL2TR001432,"May 22, 2019","Capital Breast Care Center, Washington, District of Columbia, United States|Hackensack Meridian Health, Hackensack, New Jersey, United States|Nueva Vida, Alexandria, Virginia, United States|Virginia Commonwealth University, Richmond, Virginia, United States",https://ClinicalTrials.gov/show/NCT03959267
Principal Investigator,Ermelinda Bonaccio,Roswell Park Cancer Institute,,NCT03897270,ermelinda bonaccio,ermelinda,female,0.99,668,553,Photoacoustic Imaging of the Breast in Patients With Breast Cancer and Healthy Subjects,Recruiting,No Results Available,Breast Carcinoma|Healthy Subject,Procedure: Photoacoustic Imaging,Roswell Park Cancer Institute|National Cancer Institute (NCI)|Susan G. Komen Breast Cancer Foundation,I 60217|NCI-2019-01356|P30CA016056,"April 1, 2019","Roswell Park Cancer Institute, Buffalo, New York, United States",https://ClinicalTrials.gov/show/NCT03897270
Principal Investigator,"Hanae Tokita, MD",Memorial Sloan Kettering Cancer Center,,NCT04016376,hanae tokita,hanae,female,0.98,2215,555,Study of Nerve Block Pain Management in Patients Undergoing a Double Mastectomy With Immediate Reconstruction,Recruiting,No Results Available,Breast Cancer|Breast Cancer Female,Drug: PVB Protocol|Drug: PECS-1|Drug: Serratus,Memorial Sloan Kettering Cancer Center,19-238,"July 11, 2019","Memorial Sloan Kettering Cancer Center, New York, New York, United States",https://ClinicalTrials.gov/show/NCT04016376
Principal Investigator,Shipra Gandhi,Roswell Park Cancer Institute,,NCT04081389,shipra gandhi,shipra,female,0.99,88,559,Chemokine Modulation Therapy and Standard Chemotherapy Before Surgery for the Treatment of Early Stage Triple Negative Breast Cancer,Recruiting,No Results Available,Anatomic Stage 0 Breast Cancer AJCC v8|Anatomic Stage I Breast Cancer AJCC v8|Anatomic Stage IA Breast Cancer AJCC v8|Anatomic Stage IB Breast Cancer AJCC v8|Anatomic Stage II Breast Cancer AJCC v8|Anatomic Stage IIA Breast Cancer AJCC v8|Anatomic Stage IIB Breast Cancer AJCC v8|Early-Stage Breast Carcinoma|Estrogen Receptor Negative|HER2/Neu Negative|Progesterone Receptor Negative|Prognostic Stage 0 Breast Cancer AJCC v8|Prognostic Stage I Breast Cancer AJCC v8|Prognostic Stage IA Breast Cancer AJCC v8|Prognostic Stage IB Breast Cancer AJCC v8|Prognostic Stage II Breast Cancer AJCC v8|Prognostic Stage IIA Breast Cancer AJCC v8|Prognostic Stage IIB Breast Cancer AJCC v8|Triple-Negative Breast Carcinoma,Drug: Celecoxib|Drug: Cyclophosphamide|Drug: Doxorubicin|Drug: Doxorubicin Hydrochloride|Drug: Paclitaxel|Biological: Recombinant Interferon Alfa-2b|Drug: Rintatolimod,Roswell Park Cancer Institute|National Cancer Institute (NCI),I 73718|NCI-2019-05299|P30CA016056,"September 9, 2019","Roswell Park Cancer Institute, Buffalo, New York, United States",https://ClinicalTrials.gov/show/NCT04081389
Principal Investigator,"Bonnie Ky, MD, MSCE",Perelman School of Medicine at the University of Pennsylvania,,NCT04023110,bonnie ky,bonnie,female,0.9,3712,565,Risk-Guided Cardioprotection With Carvedilol in Breast Cancer Patients Treated With Doxorubicin and/or Trastuzumab,Recruiting,No Results Available,"Cardiotoxicity|Risk Factor, Cardiovascular|Toxicity Due to Chemotherapy|Breast Cancer|Cardiomyopathies|Heart Failure",Drug: Carvedilol,Abramson Cancer Center of the University of Pennsylvania,UPCC12118,"July 17, 2019","Abramson Cancer Center of the University of Pennsylvania, Philadelphia, Pennsylvania, United States",https://ClinicalTrials.gov/show/NCT04023110
