"Rank","NCT Number","Title","Status","Study Results","Conditions","Interventions","First Posted","Locations","URL"
297,"NCT04443413","Assessing the Rate of Complications in X-Ray Therapy Versus Proton Beam Radiation Therapy After Breast Conserving Surgery or Mastectomy in Treating Patients With Breast Cancer","Recruiting","No Results Available","Anatomic Stage I Breast Cancer AJCC v8|Anatomic Stage IA Breast Cancer AJCC v8|Anatomic Stage IB Breast Cancer AJCC v8|Anatomic Stage II Breast Cancer AJCC v8|Anatomic Stage IIA Breast Cancer AJCC v8|Anatomic Stage IIB Breast Cancer AJCC v8|Anatomic Stage III Breast Cancer AJCC v8|Anatomic Stage IIIA Breast Cancer AJCC v8|Anatomic Stage IIIB Breast Cancer AJCC v8|Anatomic Stage IIIC Breast Cancer AJCC v8|Prognostic Stage I Breast Cancer AJCC v8|Prognostic Stage IA Breast Cancer AJCC v8|Prognostic Stage IB Breast Cancer AJCC v8|Prognostic Stage II Breast Cancer AJCC v8|Prognostic Stage IIA Breast Cancer AJCC v8|Prognostic Stage IIB Breast Cancer AJCC v8|Prognostic Stage III Breast Cancer AJCC v8|Prognostic Stage IIIA Breast Cancer AJCC v8|Prognostic Stage IIIB Breast Cancer AJCC v8|Prognostic Stage IIIC Breast Cancer AJCC v8","Radiation: Proton Beam Radiation Therapy|Other: Questionnaire Administration|Radiation: X-ray Therapy","June 23, 2020","Mayo Clinic in Arizona, Scottsdale, Arizona, United States|Mayo Clinic in Florida, Jacksonville, Florida, United States|Mayo Clinic in Rochester, Rochester, Minnesota, United States","https://ClinicalTrials.gov/show/NCT04443413"
298,"NCT04348955","Interest of Touch-massage in Hospital Day Care","Recruiting","No Results Available","Breast Neoplasm Malignant Female","Behavioral: Women between 18 and 70 years old with an adjuvant breast cancer histologically characterized","April 16, 2020","Insitut de Cancérologie de l'Ouest, Angers, France|Insitut de Cancérologie de l'Ouest, Angers, France","https://ClinicalTrials.gov/show/NCT04348955"
299,"NCT04243837","LYT-100 in Healthy Volunteers and BCRL","Recruiting","No Results Available","Breast Cancer Related Lymphoedema|Lymphoedema","Drug: LYT-100|Other: Matching Placebo","January 28, 2020","Nucleus Network VIC, Melbourne, Victoria, Australia","https://ClinicalTrials.gov/show/NCT04243837"
300,"NCT04300829","Cicaderma Efficacy vs Standard Care of Sites in Preventing Radiodermatitis in Non-metastatic Breast Cancer Patients","Not yet recruiting","No Results Available","Breast Adenocarcinoma|Radiation Dermatitis|Radiation Toxicity","Drug: cicaderma + simple hygiene rules|Other: Simple hygiene rules and a maximum of one topical treatment","March 9, 2020","Institut Sainte-Catherine, Avignon, France|Institut Curie, Paris, France|Institut Curie, Saint-Cloud, France","https://ClinicalTrials.gov/show/NCT04300829"
301,"NCT04251507","VR Ultrasound Guided Breast Localization","Not yet recruiting","No Results Available","Breast Neoplasm Female","Device: Oculus Go Virtual Reality Goggles","February 5, 2020",,"https://ClinicalTrials.gov/show/NCT04251507"
302,"NCT04438577","Lidocaine Mucilage-ICG as an Optical Agent for Tumor Delineation During Breast-conserving Surgery","Not yet recruiting","No Results Available","Breast Cancer","Drug: Lidocaine mucilage-ICG","June 19, 2020","Shantou Central Hospital, Shantou, Guangdong, China","https://ClinicalTrials.gov/show/NCT04438577"
303,"NCT04330625","Glucagon Receptor Inhibition to Enable Breast Cancer Patients to Benefit From PI3K Inhibitor Therapy (REMD-477)","Not yet recruiting","No Results Available","Hyperglycemia Drug Induced","Biological: REMD-477","April 1, 2020",,"https://ClinicalTrials.gov/show/NCT04330625"
304,"NCT04309929","Description of the Analgesia Obtained With the Anesthesiological Protocols Currently Used in Breast Surgery","Completed","No Results Available","Breast Cancer","Drug: Analgesics","March 17, 2020","Azienda Ospedaliero Universitaria Careggi, Florence, Italy","https://ClinicalTrials.gov/show/NCT04309929"
305,"NCT04391543","BIOpsychosocial Approach of the CAncer-RElated FAtigue (BIOCARE FActory)","Not yet recruiting","No Results Available","Breast Cancer","Other: Experimental session","May 18, 2020",,"https://ClinicalTrials.gov/show/NCT04391543"
306,"NCT04437602","Added Value of Preoperative Contrast Enhanced Mammography in Staging of Malignant Breast Lesions","Not yet recruiting","No Results Available","Breast Cancer","Diagnostic Test: Contrast Enhanced Mammography (CEM)","June 18, 2020","Halland Hospital Halmstad, Halmstad, Sweden|Helsingborg Hospital, Helsingborg, Sweden|Central Hospital Kristianstad, Kristianstad, Sweden","https://ClinicalTrials.gov/show/NCT04437602"
307,"NCT04397419","Red Bull Energy Drink Intake After Autologous Microsurgical Breast Reconstruction","Recruiting","No Results Available","Breast Cancer","Dietary Supplement: Red Bull Energy Drink|Other: Still water","May 21, 2020","Klinik Pyramide am See, Zürich, Zurich, Switzerland","https://ClinicalTrials.gov/show/NCT04397419"
308,"NCT04371913","Personalized Second Chance Breast Conservation (PSCBC): A Two Center Prospective Phase II Clinical Study","Recruiting","No Results Available","Breast Cancer","Radiation: 600cGY x 5 fractions","May 1, 2020","Weill Cornell Medicine, New York, New York, United States","https://ClinicalTrials.gov/show/NCT04371913"
309,"NCT04363892","Combined Optical and Infrared Imaging for Early Prediction of Erythema During Breast and Chestwall Radiotherapy","Not yet recruiting","No Results Available","Breast Cancer","Other: Optical and infrared imaging","April 27, 2020",,"https://ClinicalTrials.gov/show/NCT04363892"
310,"NCT04356209","Improving Theempowerment in Patients With Severe Breast Fibrosis Radio-induced Treated by Pravastatin : Benefit of e-PROs (Electronic "" Patient Reported Outcome "") on Breast-related Quality of Life","Not yet recruiting","No Results Available","Breast Cancer","Other: e-PRO Intervention|Drug: Pravastatin","April 22, 2020","ICM Val d'Aurelle, Montpellier, France","https://ClinicalTrials.gov/show/NCT04356209"
311,"NCT04257474","Barriers to Screening Breast MRI Utilization Among Patients at Elevated Risk","Recruiting","No Results Available","Breast Cancer","Behavioral: Self-Report Survey|Behavioral: Qualitative Interviews","February 6, 2020","Georgetown Lombardi Comprehensive Cancer Center, Washington, District of Columbia, United States|Moffitt Cancer Center, Tampa, Florida, United States","https://ClinicalTrials.gov/show/NCT04257474"
312,"NCT04253366","Clinical Investigation to Evaluate the Ability of MammoWave in Breast Lesions Detection","Not yet recruiting","No Results Available","Breast Cancer","Device: Clinical investigation device class IIa not marked CE","February 5, 2020","Istituto Clinico Humanitas, Rozzano, Milano, Italy|Azienda Ospedaliera Universitaria S. Martino Di Genova, Genova, Italy|Hospital Virgen de la Salud, Toledo, Spain","https://ClinicalTrials.gov/show/NCT04253366"
313,"NCT04397029","Assessing the Sensitivity of ""SureTouch™"" in Identifying Clinically Significant Masses in Women Undergoing Diagnostic and Screening Mammography","Recruiting","No Results Available","Breast Cancer","Device: SureTouch","May 21, 2020","George Washington University - Medical Faculty Associates, Washington, District of Columbia, United States","https://ClinicalTrials.gov/show/NCT04397029"
314,"NCT04424758","Testing Video Information About Mammography Screening","Recruiting","No Results Available","Breast Cancer","Other: Video information about mammography screening|Other: Video information about smart energy systems","June 11, 2020","University of Copenhagen, Section of General Practice, Copenhagen, Capital, Denmark","https://ClinicalTrials.gov/show/NCT04424758"
315,"NCT04350957","Low-dose Imaging Technique (LITE)","Not yet recruiting","No Results Available","Breast Cancer","Diagnostic Test: Low-dose Imaging","April 17, 2020",,"https://ClinicalTrials.gov/show/NCT04350957"
316,"NCT04348123","Interventional Program Educates, Identifies + Overcomes Barriers to Complete Screening Mammography","Not yet recruiting","No Results Available","Breast Cancer","Other: Survey|Behavioral: Education Session","April 15, 2020","Cleveland Clinic, Case Comprehensive Cancer Center, Cleveland, Ohio, United States","https://ClinicalTrials.gov/show/NCT04348123"
317,"NCT04302441","A Study to Evaluate Vinorelbine Plus Capecitabine Combined With Trastuzumab for HER2 Positive Patients Following Neoadjuvant Chemotherapy","Recruiting","No Results Available","Breast Cancer","Drug: Vinorelbine|Drug: Capecitabine","March 10, 2020","Breast cancer institute of Fudan University Cancer Hospital, Shanghai, Shanghai, China","https://ClinicalTrials.gov/show/NCT04302441"
318,"NCT04268134","Altering Lipids for Tolerance of Aromatase Inhibitor Therapy","Not yet recruiting","No Results Available","Breast Cancer","Dietary Supplement: Omega-3 fatty acid supplement","February 13, 2020","University of Michigan Rogel Cancer Center, Ann Arbor, Michigan, United States","https://ClinicalTrials.gov/show/NCT04268134"
319,"NCT04258280","Improving Genetic Counseling for BRCA+ Mothers","Not yet recruiting","No Results Available","Breast Cancer","Behavioral: Education and counseling|Behavioral: Education","February 6, 2020",,"https://ClinicalTrials.gov/show/NCT04258280"
320,"NCT04257643","Aquatic Versus Land Based Exercise on Lymphedema Post Mastectomy","Completed","No Results Available","Breast Cancer","Other: aquatic based exercise.|Other: land-based exercise.","February 6, 2020","Cairo university., Cairo., Cairo, Egypt","https://ClinicalTrials.gov/show/NCT04257643"
321,"NCT04239716","Regional Anesthesia for Modified Radical Mastectomy With Axillary Lymph Node Dissection","Recruiting","No Results Available","Breast Cancer","Other: regional anesthesia","January 27, 2020","Tanta University, Faculty of Medicine, Tanta, Egypt","https://ClinicalTrials.gov/show/NCT04239716"
322,"NCT04225572","Physical Rehabilitation Evaluation and Optimal Physical Therapy (PRE-OPT)","Recruiting","No Results Available","Breast Cancer","Behavioral: Physical Therapy: Dependent on Patient's Needs","January 13, 2020","University of Minnesota Masonic Cancer Center, Minneapolis, Minnesota, United States","https://ClinicalTrials.gov/show/NCT04225572"
323,"NCT04441099","NBE-002 in Patients With Advanced Solid Tumors","Not yet recruiting","No Results Available","Advanced Solid Tumor|Advanced Cancer|Triple Negative Breast Cancer","Drug: NBE-002","June 22, 2020",,"https://ClinicalTrials.gov/show/NCT04441099"
324,"NCT04379570","Additional Support Program Via Text Messaging and Telephone-Based Counseling for Breast Cancer Patients Receiving Hormonal Therapy","Not yet recruiting","No Results Available","Anatomic Stage I Breast Cancer AJCC v8|Anatomic Stage II Breast Cancer AJCC v8|Anatomic Stage III Breast Cancer AJCC v8|HER2 Negative Breast Carcinoma|Hormone Receptor Positive Breast Carcinoma|Invasive Breast Carcinoma|Prognostic Stage I Breast Cancer AJCC v8|Prognostic Stage II Breast Cancer AJCC v8|Prognostic Stage III Breast Cancer AJCC v8","Other: Educational Intervention|Other: Text Message-based Navigation Intervention|Behavioral: Motivational Interviewing|Other: Best Practice|Other: Questionnaire Administration|Other: Quality-of-Life Assessment","May 7, 2020",,"https://ClinicalTrials.gov/show/NCT04379570"
325,"NCT04372459","Online Psychosocial Cancer Screening, Monitoring and Stepped Treatment in Cancer Survivors","Not yet recruiting","No Results Available","Breast Cancer|Psychological Distress|Emotional Disorder","Behavioral: Online integrated and stepped psychosocial care|Behavioral: Usual psychosocial care","May 4, 2020",,"https://ClinicalTrials.gov/show/NCT04372459"
326,"NCT04390529","Immediate Breast Reconstruction Following Mastectomy (IRMA)","Recruiting","No Results Available","Breast Cancer Female","Other: quality-of-life questionnaire: BREAST-Q","May 15, 2020","Kantonsspital Baden, PD Dr. med. Cornelia Leo, Baden, Aargau, Switzerland|Tumor- und Brustzentrum ZeTuP, Dr. Véronique Dupont Lampert, St. Gallen, Saint Gallen, Switzerland|Kantonsspital Frauenfeld, Prof. Dr. med. Mathias K. Fehr, Frauenfeld, Thurgau, Switzerland|Ospedale Regionale Bellinzona e Valli, Dr. Begoña Lipp von Wattenwyl, Bellinzona, Ticino, Switzerland|Campus SLB Sonnenhof AG, Bern, Switzerland|Universitätsspital Zürich, Klinik für Gynäkologie, Zürich, Switzerland","https://ClinicalTrials.gov/show/NCT04390529"
327,"NCT04242277","Wide-field Optical Coherence Tomography Imaging of Excised Breast Tissue.","Not yet recruiting","No Results Available","Breast Cancer Female","Device: Investigational WF-OCT device","January 27, 2020","MD Anderson Cancer Center, Houston, Texas, United States","https://ClinicalTrials.gov/show/NCT04242277"
328,"NCT04440683","Antler Plate on Preventing Mammary High-risk Lesions From Malignant Development","Recruiting","No Results Available","Breast Cancer Prevention",,"June 22, 2020","First Hospital of Jilin University, Changchun, Jilin, China","https://ClinicalTrials.gov/show/NCT04440683"
329,"NCT04257799","Lumpectomy Specimen Margin Evaluation With Tomography and Structured Light Imaging","Recruiting","No Results Available","Breast Cancer Female","Other: Structured Light Imaging (SLI) System","February 6, 2020","Dartmouth Hitchcock Medical Center, Lebanon, New Hampshire, United States","https://ClinicalTrials.gov/show/NCT04257799"
330,"NCT04447651","Patient Response to Immunotherapy Using Spliceosome Mutational Markers (PRISMM)","Not yet recruiting","No Results Available","Metastatic Breast Cancer|SF3B1 Gene Mutation|Spliceosome Mutation","Other: Recommendation for treatment with immunotherapy","June 25, 2020",,"https://ClinicalTrials.gov/show/NCT04447651"
331,"NCT04390685","Prevention of Breast Cancer-related Lymphedma With Tacrolimus","Recruiting","No Results Available","Lymphedema","Drug: Tacrolimus ointment","May 15, 2020","Sydvestjysk Sygehus, Esbjerg, Denmark|Department of Plastic and Reconstructive Surgery, Odense, Denmark|Sygehus Lillebælt Vejle, Vejle, Denmark","https://ClinicalTrials.gov/show/NCT04390685"
332,"NCT04320693","Expanded Access for IMMU-132","Approved for marketing","No Results Available","Metastatic Triple-Negative Breast Carcinoma","Drug: IMMU-132","March 25, 2020",,"https://ClinicalTrials.gov/show/NCT04320693"
333,"NCT04222790","A Multicenter, Double-blind, Randomized Controlled Phase II Clinical Study of Monosialic Gangliosides to Prevent Albumin-bound Paclitaxel Neurotoxicity","Not yet recruiting","No Results Available","Early Breast Cancer","Drug: monosialic gangliosides|Other: Placebo","January 10, 2020",,"https://ClinicalTrials.gov/show/NCT04222790"
334,"NCT04257162","HER2-PREDICT: Translational Study of Tumor Samples From DS8201-A-U301 and DS8201-A-U302 Trials.","Recruiting","No Results Available","Metastatic Breast Cancer","Other: Tumor and Blood sample collection","February 5, 2020","Hospital Clínic de Barcelona, Barcelona, Spain","https://ClinicalTrials.gov/show/NCT04257162"
335,"NCT04274504","Osteopontin in Metastatic Breast Cancer Patients","Completed","No Results Available","Survival, Prosthesis","Diagnostic Test: Osteopontin","February 18, 2020","Mansoura University Oncology Center, Mansoura, Daqahliyah, Egypt","https://ClinicalTrials.gov/show/NCT04274504"
336,"NCT04390698","Opioid Free Anesthesia in Breast Cancer Surgery","Not yet recruiting","No Results Available","Opioid Free Anesthesia","Procedure: paravertebral block|Drug: opioid free anesthesia|Procedure: sham block|Procedure: opioid general anesthesia","May 15, 2020",,"https://ClinicalTrials.gov/show/NCT04390698"
337,"NCT04248608","Perioperative Analgesic Modalities for Breast Cancer Surgeries","Recruiting","No Results Available","Analgesia","Procedure: serratus plane block|Procedure: erector spinae block|Drug: Morphine Sulfate","January 30, 2020","Department of anesthesia and pain medicine. National Cancer Institute, Cairo, Egypt","https://ClinicalTrials.gov/show/NCT04248608"
338,"NCT04301011","Study of TBio-6517, Given Intratumorally, Alone or in Combination With Pembrolizumab, in Solid Tumors","Recruiting","No Results Available","Solid Tumor|Triple Negative Breast Cancer|Microsatellite Stable Colorectal Cancer","Biological: TBio-6517|Biological: Pembrolizumab","March 9, 2020","Mayo Clinic, Phoenix, Arizona, United States|Mayo Clinic, Jacksonville, Florida, United States|Sylvester Comprehensive Cancer Center / UMHC, Miami, Florida, United States|University of Kansas Medical Center, Kansas City, Kansas, United States|Mayo Clinic, Rochester, Minnesota, United States|The Billings Clinic, Billings, Montana, United States|University of Texas MD Anderson Cancer Center, Houston, Texas, United States","https://ClinicalTrials.gov/show/NCT04301011"
339,"NCT04292860","Reverse Axillary Mapping in Breast Radiation Treatment Planning","Not yet recruiting","No Results Available","Breast Cancer|Lymphedema",,"March 3, 2020",,"https://ClinicalTrials.gov/show/NCT04292860"
340,"NCT04400552","Perioperative Oral Nutrition Supplementation in Malnourished Surgical Cancer Patients","Recruiting","No Results Available","Cancer of Breast|Cancer Colon","Dietary Supplement: ONS Pre-op + ONS Post-op|Dietary Supplement: ONS Pre-op + ONS Post-op + ONS Post-op 3 months|Dietary Supplement: Usual intake Pre-op + ONS Post-op","May 22, 2020","International Medical University, Kuala Lumpur, Malaysia","https://ClinicalTrials.gov/show/NCT04400552"
341,"NCT04418115","Fatigue as a Late Effect in Breast Cancer Survivors - is Acupuncture a Treatment Option?","Not yet recruiting","No Results Available","Fatigue|Depression, Anxiety|Insomnia|Hot Flashes|Quality of Life","Other: Acupuncture; based on Tradidtional Chinese Medicine","June 5, 2020",,"https://ClinicalTrials.gov/show/NCT04418115"
342,"NCT04372862","Comparison Between Serratus Anterior Plane Block and Erector Spinae Plane Block for Mastectomy","Active, not recruiting","No Results Available","Breast Cancer Postoperative Pain","Procedure: Plane block","May 4, 2020","Suez Canal University, Ismailia, Egypt","https://ClinicalTrials.gov/show/NCT04372862"
343,"NCT04322331","Tumor Immune Mechanism of Axillary Lymph Node Metastasis in Early Luminal Type A Breast Cancer","Enrolling by invitation","No Results Available","Immune Microenvironment|Luminal A|Lymph Node Metastases","Other: no intervention","March 26, 2020","Peking university people's hospital, Beijing, China","https://ClinicalTrials.gov/show/NCT04322331"
344,"NCT04324346","Central Catheters Used for Chemotherapy in Women With Breast Cancer","Recruiting","No Results Available","Catheter Related Complications","Drug: FEC75 (or EC90) x 6|Drug: FEC100 + Taxotere (EC90 + Taxotere) 3+3|Drug: Paclitaxel","March 27, 2020","Onkologiska kliniken, Karolinska University Hospital, Danderyd Hospital, Stockholm, Sweden","https://ClinicalTrials.gov/show/NCT04324346"
345,"NCT04261387","LUT014 for the Treatment of Radiation Induced Dermatitis in Breast Cancer Patients","Not yet recruiting","No Results Available","Radiation Dermatitis","Drug: LUT014 Gel","February 7, 2020","University Hospital Assuta Ashdod, Ashdod, Israel","https://ClinicalTrials.gov/show/NCT04261387"
346,"NCT04420871","Pharmacokinetic and Safety Comparison of Two Capecitabine Tablets in Patients With Colorectal or Breast Cancer","Completed","No Results Available","Patient Participation","Drug: 150 mg of Xeloda®|Drug: 150 mg of capecitabine","June 9, 2020","Phase Ⅰ Clinical Research Center, Qingdao, Shandong, China","https://ClinicalTrials.gov/show/NCT04420871"
347,"NCT04303325","Effect of Esketamine on Postoperative Depression、Gut Microbiota、Bispectral Index Data of Depression Patients Undergoing Breast Cancer Operation (ESPOD-BI)","Not yet recruiting","No Results Available","Depression","Drug: Esketamine|Drug: Saline Solution","March 11, 2020","the First Hospital of China Medical University, Shenyang, Liaoning, China","https://ClinicalTrials.gov/show/NCT04303325"
348,"NCT04282967","Streaming Web-based Exercise At Home: A Pilot Study","Not yet recruiting","No Results Available","Prostate Cancer|Breast Cancer Female","Behavioral: Exercise","February 25, 2020","Cedars Sinai Medical Center, Los Angeles, California, United States","https://ClinicalTrials.gov/show/NCT04282967"
349,"NCT04257396","Carbon-Fibre Accessory (CARA) for Supine Breast Positioning to Reduce Toxicity in Whole Breast Radiotherapy","Recruiting","No Results Available","Adjuvant Radiotherapy for Breast Cancer","Device: Carbon-Fibre Adjustable Reuseable Accessory (CARA)","February 6, 2020","BC Cancer, Vancouver, British Columbia, Canada","https://ClinicalTrials.gov/show/NCT04257396"
350,"NCT04290585","Technology and Health Communication in Improving Health Outcomes in Patients Scheduled for Mammography","Completed","No Results Available","Female Breast Carcinoma|Healthy Subject","Other: Questionnaire Administration|Behavioral: Telephone-Based Intervention","March 2, 2020","Fox Chase Cancer Center, Philadelphia, Pennsylvania, United States","https://ClinicalTrials.gov/show/NCT04290585"
351,"NCT04395339","GM1 Prophylaxis for WBRT Related Cognitive Dysfunction","Recruiting","No Results Available","Brain Metastases|Radiotherapy Side Effect|Cognitive Impairment|Gangliosidosis, GM1|Breast Cancer","Drug: Monosialotetrahexosyl ganglioside (GM1)|Drug: Control","May 20, 2020","Sun Yat-sen University Cancer Center, Guangzhou, Guangdong, China","https://ClinicalTrials.gov/show/NCT04395339"
352,"NCT04385563","A Study to Evaluate the Efficacy and Safety of the Combination of TQ-B211 Plus Docetaxel in Patients With HER2-positive MBC.","Recruiting","No Results Available","HER2-positive Metastatic Breast Cancer","Drug: TQ-B211|Drug: Herceptin®|Drug: docetaxel","May 13, 2020","Harbin Medical University Cancer Hospital, Harbin, Heilongjiang, China|Fudan University Shanghai Cancer Center, Shanghai, Shanghai, China","https://ClinicalTrials.gov/show/NCT04385563"
353,"NCT04365114","Patient Outcomes From Second Film-readers and Test Threshold Relaxation in Breast Screening","Enrolling by invitation","No Results Available","Breast Cancer|Ductal Carcinoma in Situ","Diagnostic Test: Breast Screening Mammography with single reader|Diagnostic Test: Breast screening mammography with two readers|Diagnostic Test: Test threshold","April 28, 2020","Univesity of Warwick, Coventry, Warwickshire, United Kingdom","https://ClinicalTrials.gov/show/NCT04365114"
354,"NCT04340180","Evaluating the Performance of AI in Evaluating Breast MRI Performed With Dose Reduction","Not yet recruiting","No Results Available","Breast Benign Tumor|Breast Malignant Tumor","Drug: Standard of Care (SOC) gadolinium Breast MRI|Drug: reduced 1/4 dose gadolinium Breast MRI with Artificial Intelligence (AI) to aid in evaluation.","April 9, 2020","The Kirklin Clinic, Birmingham, Alabama, United States","https://ClinicalTrials.gov/show/NCT04340180"
355,"NCT04252859","[18F]Fluoroestradiol Imaging of Invasive Lobular Carcinoma Using PET/CT","Not yet recruiting","No Results Available","Invasive Lobular Breast Carcinoma","Drug: [18F]Fluoroestradiol (FES) PET/CT","February 5, 2020",,"https://ClinicalTrials.gov/show/NCT04252859"
356,"NCT04248179","The Ultrasound-guided Multiple-injection Costotransverse Block for Mastectomy and Primary Reconstructive Surgery.","Recruiting","No Results Available","Breast Cancer|Ductal Carcinoma in Situ","Drug: Ropivacaine injection|Drug: Saline 0.9%|Drug: Sufentanil and PONV prophylaxis","January 30, 2020","Department of Anaesthesiology and Intensive Care Medicine, Zealand University Hospital, Roskilde, Roskilde, Zealand Region, Denmark","https://ClinicalTrials.gov/show/NCT04248179"
357,"NCT04397744","Unidas Por Vida y Salud: Increasing Breast and Cervical Cancer Screening in El Paso","Completed","No Results Available","Breast Cancer|Cervical Cancer","Behavioral: Unidas por Vida y Salud prevention program","May 21, 2020","The University of Texas Health Science Center at Houston, Houston, Texas, United States","https://ClinicalTrials.gov/show/NCT04397744"
358,"NCT04426019","Using a Lay Health Worker Program to Increase Breast and Cervical Cancer Screening in Low-Income Hispanic Women","Completed","No Results Available","Breast Cancer|Cervical Cancer","Behavioral: CLS Intervention|Behavioral: No CLs intervention","June 11, 2020","The University of Texas Health Science Center at Houston, Houston, Texas, United States","https://ClinicalTrials.gov/show/NCT04426019"
359,"NCT04335409","Pneumonitis After Radiotherapy of Breast or Lung Cancer","Not yet recruiting","No Results Available","Breast Cancer|Lung Cancer","Diagnostic Test: Questionnaire|Other: Mobile Application","April 6, 2020",,"https://ClinicalTrials.gov/show/NCT04335409"
360,"NCT04348188","Study of the Effectiveness of Supervised vs. Non-Supervised Therapeutic Exercise in Cancer Patients","Not yet recruiting","No Results Available","Breast Cancer|Colon Cancer","Behavioral: Education program on healthy habits","April 16, 2020","Hospital Universitario Infanta Leonor, Madrid, Spain","https://ClinicalTrials.gov/show/NCT04348188"
361,"NCT04433494","A Study of TY-302 in Patients With Advanced Solid Tumors","Not yet recruiting","No Results Available","Breast Cancer|Solid Tumor","Drug: TY-302: capsule, 25mg/50mg ; Tamoxifen: tablet,10mg","June 16, 2020",,"https://ClinicalTrials.gov/show/NCT04433494"
362,"NCT04418856","The Effects of Light Therapy to Treat Cancer-related Side Effects","Not yet recruiting","No Results Available","Breast Cancer|Circadian Rhythms|Fatigue|Sleep Disturbance|Cognitive Impairment|Inflammatory Response|Depression","Device: Light Glasses (Experimental)|Device: Light Glasses (Comparison)","June 5, 2020",,"https://ClinicalTrials.gov/show/NCT04418856"
