"Rank","NCT Number","Title","Status","Study Results","Conditions","Interventions","First Posted","Locations","URL"
203,"NCT04282031","A Study of BPI-1178 in Patients With Advanced Solid Tumor and HR+/HER2- Breast Cancer","Not yet recruiting","No Results Available","Advanced Solid Tumor|Breast Neoplasms","Drug: BPI-1178|Drug: Fulvestrant|Drug: Letrozole","February 24, 2020","Fudan University Shanghai Cancer Center, Shanghai, Shanghai, China","https://ClinicalTrials.gov/show/NCT04282031"
204,"NCT04365569","Evaluating the Effectiveness of an Individualized Nutrition and Physical Activity Counseling Program","Not yet recruiting","No Results Available","Breast Cancer","Behavioral: Nutrition and physical activity counseling program","April 28, 2020","Cleveland Clinic Florida Weston, Case Comprehensive Cancer Center, Weston, Florida, United States","https://ClinicalTrials.gov/show/NCT04365569"
205,"NCT04303741","A Phase II Trial of Camrelizumab in Combination With Apatinib and Eribulin in Patients With Advanced TNBC","Recruiting","No Results Available","Breast Cancer","Drug: Camrelizumab|Drug: Apatinib|Drug: Eribulin","March 11, 2020","The First Affiliated Hospital, Sun Yat-Sen University, Guangzhou, Guangdong, China|Sun Yat-Sen Memorial Hospital of Sun Yat-Sen University, Guangzhou, Guangdong, China","https://ClinicalTrials.gov/show/NCT04303741"
206,"NCT04265872","Bortezomib Followed by Pembrolizumab and Cisplatin in metTNBC","Not yet recruiting","No Results Available","Breast Cancer","Drug: Bortezomib; pembrolizumab and cisplatin injections--bortezomib followed by pembro/cis","February 12, 2020","Baylor University Medical Center, Baylor Charles A Sammons Cancer Center, Dallas, Texas, United States","https://ClinicalTrials.gov/show/NCT04265872"
207,"NCT04215744","Nail Changes Associated With Chemotherapy and Prevention of Nail Pigmentation by Ice Water Immersion","Not yet recruiting","No Results Available","Breast Cancer","Behavioral: Ice water immersion","January 2, 2020","Sun Yat-sen University Cancer Center, Guangzhou, Guangdong, China","https://ClinicalTrials.gov/show/NCT04215744"
208,"NCT04414202","Observational Study of Intra-operative Partial Irradiation of Invasive Ductal Breast Carcinomas With a Good Prognosis","Recruiting","No Results Available","Invasive Breast Cancer|Breast-conserving Surgery","Procedure: tumorectomy with axillary dissection (sentinel lymph node)|Radiation: per-operative partial irradiation","June 4, 2020","Icm Val D'Aurelle, Montpellier, Herault, France","https://ClinicalTrials.gov/show/NCT04414202"
209,"NCT04296929","The Effect of Complex Decongestive Physiotherapy on Sensory Parameters in Breast Cancer Related Lymphedema.","Recruiting","No Results Available","Lymphedema|Lymphedema of Upper Arm|Breast Cancer","Other: Complex Decongestive Physiotherapy","March 5, 2020","Hacettepe University, Ankara, Samanpazari, Turkey","https://ClinicalTrials.gov/show/NCT04296929"
210,"NCT04300790","Study to Evaluate the Effect of Metformin in the Prevention of HG in HR[+]/HER2[-] PIK3CA-mut Advanced BC Patients","Not yet recruiting","No Results Available","Breast Cancer","Drug: Alpelisib|Drug: Metformin|Drug: Fulvestrant","March 9, 2020",,"https://ClinicalTrials.gov/show/NCT04300790"
211,"NCT04300478","Appetite and Exercise in Breast Cancer Survivors","Recruiting","No Results Available","Overweight|Breast Cancer|Obesity","Behavioral: REx Condition First|Behavioral: Sedentary Control Condition First","March 9, 2020","Univeristy of Colorado Anschutz Medical Campus, Aurora, Colorado, United States|University of Colorado Cancer Center, Denver, Colorado, United States","https://ClinicalTrials.gov/show/NCT04300478"
212,"NCT04276337","Genetic Characteristics of HER2 Positive Breast Cancer With Neoadjuvant TCHP Chemotherapy","Active, not recruiting","No Results Available","HER2-positive Breast Cancer|Chemotherapy Effect|Circulating Tumor DNA","Diagnostic Test: LiquidSCAN(Trade Mark) / CancerSCAN(Trade Mark)","February 19, 2020","Samsung Medical Center, Seoul, Korea, Republic of","https://ClinicalTrials.gov/show/NCT04276337"
213,"NCT04300283","Pre-operative Hypnosis to Prevent Side Effects After Surgery","Recruiting","No Results Available","Breast Cancer Surgery","Behavioral: Hypnosis","March 9, 2020","Oslo University Hospital, Oslo, Norway","https://ClinicalTrials.gov/show/NCT04300283"
214,"NCT04368442","Cohort Study of Patients With HER2-negative MBC and BRCA 1/2 Pathogenic Mutation","Recruiting","No Results Available","Breast Cancer Metastatic",,"April 29, 2020","Samsung Medical Center, Seoul, Korea, Republic of","https://ClinicalTrials.gov/show/NCT04368442"
215,"NCT04288089","A Study of H3B-6545 in Combination With Palbociclib in Women With Advanced or Metastatic Estrogen Receptor-Positive Human Epidermal Growth Factor Receptor-2 (HER2)-Negative Breast Cancer","Not yet recruiting","No Results Available","Receptors, Estrogen|Genes, Erbb-2|Breast Neoplasms","Drug: Palbociclib (75, 100, 125 milligram [mg])|Drug: H3B-6545 (300, 450 mg)","February 27, 2020","Florida Cancer Specialists, Sarasota, Florida, United States|Massachusetts General Hospital, Boston, Massachusetts, United States|Saint Luke's Cancer Institute, Saint Peters, Missouri, United States|Tennessee Oncology, Nashville, Tennessee, United States|Royal Marsden NHS Foundation Trust, London, United Kingdom|Christie NHS Foundation Trust, Manchester, United Kingdom|Velindre Cancer Centre, Whitchurch, United Kingdom","https://ClinicalTrials.gov/show/NCT04288089"
216,"NCT04398108","A Study to Evaluate the Pharmacokinetics of Margetuximab in Chinese Patients With HER2+ MBC","Not yet recruiting","No Results Available","HER2 Positive Metastatic Breast Cancer","Drug: Margetuximab Margetuximab-IV","May 21, 2020",,"https://ClinicalTrials.gov/show/NCT04398108"
217,"NCT04224272","A Study of ZW25 With Palbociclib Plus Fulvestrant in Patients With HER2+/HR+ Advanced Breast Cancer","Recruiting","No Results Available","HER2+/HR+ Breast Cancer","Drug: ZW25|Drug: Palbociclib|Drug: Fulvestrant","January 13, 2020","Sarah Cannon Research Institute, Nashville, Tennessee, United States|South Texas Accelerated Research Therapeutics, San Antonio, Texas, United States|Hospital Universitario Vall d'Hebrón, Barcelona, Spain|Hospital Ruber Internacional, Madrid, Spain|Hospital Clínico Universitario de Valencia, Valencia, Spain","https://ClinicalTrials.gov/show/NCT04224272"
218,"NCT04228991","Hypofractionated LocoRegional Radiotherapy in Breast Cancer","Not yet recruiting","No Results Available","Breast Neoplasms|Radiotherapy|Lymphedema","Radiation: Locoregional radiation treatment - Conventional fractionation|Radiation: Locoregional radiation treatment - Hypofractionation","January 14, 2020","Juravinski Cancer Centre, Hamilton, Ontario, Canada","https://ClinicalTrials.gov/show/NCT04228991"
219,"NCT04379414","YES Study - Newly Diagnosed/Metastatic Intervention","Not yet recruiting","No Results Available","Breast Cancer|Symptom, Behavioral","Behavioral: YES portal","May 7, 2020","Dana Farber Cancer Institute, Boston, Massachusetts, United States","https://ClinicalTrials.gov/show/NCT04379414"
220,"NCT04368468","Modifications of Immune Microenvironment Induced by Neoadjuvant Chemotherapy in Triple-negative BC","Not yet recruiting","No Results Available","Triple Negative Breast Cancer","Other: biomarker evolution","April 29, 2020",,"https://ClinicalTrials.gov/show/NCT04368468"
221,"NCT04316117","Using FDG-PET/CT to Assess Response of Bone-Dominant Metastatic Breast Cancer, FEATURE Study","Recruiting","No Results Available","Anatomic Stage IV Breast Cancer AJCC v8|Hormone Receptor Positive Breast Carcinoma|Metastatic Breast Carcinoma|Prognostic Stage IV Breast Cancer AJCC v8","Procedure: Computed Tomography|Other: Fludeoxyglucose F-18|Procedure: Positron Emission Tomography","March 20, 2020","Carle on Vermilion, Danville, Illinois, United States|Carle Physician Group-Effingham, Effingham, Illinois, United States|Carle Physician Group-Mattoon/Charleston, Mattoon, Illinois, United States|Carle Cancer Center, Urbana, Illinois, United States|The Carle Foundation Hospital, Urbana, Illinois, United States|University of Oklahoma Health Sciences Center, Oklahoma City, Oklahoma, United States","https://ClinicalTrials.gov/show/NCT04316117"
222,"NCT04335669","NordicTrip, a Translational Study of Preoperative Chemotherapy in TNBC","Recruiting","No Results Available","Breast Cancer|Triple Negative Breast Neoplasms","Drug: epirubicin, cyclophosphamide, paclitaxel, carboplatin|Drug: epirubicin, cyclophosphamide, capecitabine, paclitaxel, carboplatin","April 6, 2020","Södra Älvsborgs Hospital, Borås, Sweden|Gävle hospital, Department of Oncology, Gävle, Sweden|Sahlgrenska University Hospital, Department of Oncology, Göteborg, Sweden|Halmstad Hospital, Department of Surgery, Halmstad, Sweden|Ryhov Hospital, Jönköping, Sweden|Karlstad Hospital, Karlstad, Sweden|Linköping University Hospital, Linköping, Sweden|Skåne University Hospital, Department of Oncology, Malmö, Sweden|Capio S:t Göran Hospital, Department of Oncology, Stockholm, Sweden|Södersjukhuset, Department of Oncology, Stockholm, Sweden|Sundsvall hospital, Sundsvall, Sweden|Norrland University Hospital, Department of Oncology, Umeå, Sweden|Academical Hospital, Department of Oncology, Uppsala, Sweden|Västmanlands Hopsital Västerås, Västerås, Sweden|Växjö Hospital, Department of Oncology, Växjö, Sweden|Örebro University Hospital, Department of Oncology, Örebro, Sweden","https://ClinicalTrials.gov/show/NCT04335669"
223,"NCT04350398","Rehabilitation Through Hippotherapy for the Management of Women After Primary Treatment of Breast Cancer","Recruiting","No Results Available","Breast Cancer Female|Side Effects|Psychological Distress|Physical Disability","Other: Hippotherapy|Other: Conventional therapy","April 17, 2020","Institut Equiphoria, La Canourgue, France","https://ClinicalTrials.gov/show/NCT04350398"
224,"NCT04297267","A Study to Evaluate Gemcitabine Plus Cisplatin in the Treatment of TNBC Patients Following Neoadjuvant Chemotherapy","Recruiting","No Results Available","Triple Negative Breast Cancer","Drug: Gemcitabine|Drug: Cisplatin","March 5, 2020","Cancer Hospital/ Institute, Fudan University, Shanghai, Shanghai, China","https://ClinicalTrials.gov/show/NCT04297267"
225,"NCT04351230","Abemaciclib With or Without T-DM1 for the Treatment of HER2-Positive Metastatic Breast Cancer","Not yet recruiting","No Results Available","Anatomic Stage IV Breast Cancer AJCC v8|HER2 Positive Breast Carcinoma|Metastatic Breast Carcinoma|Prognostic Stage IV Breast Cancer AJCC v8","Drug: Abemaciclib|Biological: Trastuzumab Emtansine","April 17, 2020","Mayo Clinic in Arizona, Scottsdale, Arizona, United States|Mayo Clinic in Florida, Jacksonville, Florida, United States|Carle Cancer Center NCI Community Oncology Research Program, Urbana, Illinois, United States|Ochsner NCI Community Oncology Research Program, New Orleans, Louisiana, United States|Michigan Cancer Research Consortium NCORP, Ann Arbor, Michigan, United States|Mayo Clinic, Rochester, Minnesota, United States|Metro Minnesota Community Oncology Research Consortium, Saint Louis Park, Minnesota, United States|Washington University School of Medicine, Saint Louis, Missouri, United States|Saint Vincent Hospital Cancer Center Green Bay, Green Bay, Wisconsin, United States|Marshfield Medical Center-Marshfield, Marshfield, Wisconsin, United States","https://ClinicalTrials.gov/show/NCT04351230"
226,"NCT04305834","Abemaciclib Monotherapy in Treating Older Patients With Hormone Receptor Positive Metastatic Breast Cancer","Recruiting","No Results Available","Anatomic Stage IV Breast Cancer AJCC v8|Hormone Receptor Positive Breast Carcinoma|Metastatic Breast Carcinoma|Prognostic Stage IV Breast Cancer AJCC v8","Drug: Abemaciclib|Other: Questionnaire Administration","March 12, 2020","City of Hope Medical Center, Duarte, California, United States","https://ClinicalTrials.gov/show/NCT04305834"
227,"NCT04408118","First Line Atezolizumab, Paclitaxel, and Bevacizumab (Avastin®) in mTNBC","Not yet recruiting","No Results Available","Metastatic Breast Cancer|Advanced Breast Cancer|Triple Negative Breast Cancer","Drug: Atezolizumab|Drug: Paclitaxel|Drug: Bevacizumab","May 29, 2020","Istituto Nazionale Tumori IRCCS Fondazione G. Pascale, Naples, Italy|Istituto Oncologico Veneto IRCCS, Padova, Italy|Hospital Prof. Doutor Fernando da Fonseca EPE, Amadora, Portugal|Champalimaud Foundation, Lisbon, Portugal|Centro Hospitalar Universitário do Porto, Porto, Portugal|Hospital de Dénia-MarinaSalud, Dénia, Alicante, Spain|Hospital Universitario La Ribera, Alzira, Spain|Instituto de Oncología (IOB), Barcelona, Spain|Hospital Universitario Insular de Gran Canaria, Las Palmas De Gran Canaria, Spain|Hospital Universitari Arnau de Vilanova, Lleida, Spain|Hospital Clínico San Carlos, Madrid, Spain|Hospital Ruber Juan Bravo, Madrid, Spain|Hospital Universitario Ramón y Cajal, Madrid, Spain|MD Anderson Cancer Center, Madrid, Spain|Hospital Universitario Son Llàtzer, Palma De Mallorca, Spain|Complejo Hospitalario de Navarra, Pamplona, Spain|Hospital Universitari Sant Joan de Reus, Reus, Spain|Hospital Universitario San Juan de Alicante, San Juan De Alicante, Spain|Hospital Universitario Virgen del Rocío, Sevilla, Spain|Hospital Quirónsalud Valencia, Valencia, Spain|Hospital Universitario Miguel Servet, Zaragoza, Spain","https://ClinicalTrials.gov/show/NCT04408118"
228,"NCT04303221","Effects of the Anchor System in the Postural Stability","Recruiting","No Results Available","Breast Cancer|Balance; Distorted","Other: Exercise","March 11, 2020","Medical School of Ribeirão Preto, Ribeirão Preto, São Paulo, Brazil","https://ClinicalTrials.gov/show/NCT04303221"
229,"NCT04262518","Feasibility of Integrating the Outcomes4Me Smartphone Navigation Application Into the Care Management of Breast Cancer Patients","Recruiting","No Results Available","Breast Cancer|Invasive Breast Cancer|Metastatic Breast Cancer|Breast Carcinoma|Metastatic Breast Carcinoma","Device: Outcomes4Me Mobile App","February 10, 2020","Massachusetts General Hospital, Boston, Massachusetts, United States","https://ClinicalTrials.gov/show/NCT04262518"
230,"NCT04291950","Epigenetics of TNBC in Overweight and Obese Hispanic & Non-Hispanic White Women","Not yet recruiting","No Results Available","Triple Negative Breast Cancer","Procedure: Needle core biopsy","March 2, 2020","University of Arizona Cancer Center, Tucson, Arizona, United States","https://ClinicalTrials.gov/show/NCT04291950"
231,"NCT04348747","Dendritic Cell Vaccines Against Her2/Her3, Cytokine Modulation Regimen, and Pembrolizumab for the Treatment of Brain Metastasis From Triple Negative Breast Cancer or HER2+ Breast Cancer","Not yet recruiting","No Results Available","Anatomic Stage IV Breast Cancer AJCC v8|Metastatic Malignant Neoplasm in the Brain|Metastatic Triple-Negative Breast Carcinoma|Prognostic Stage IV Breast Cancer AJCC v8","Biological: Anti-HER2/HER3 Dendritic Cell Vaccine|Drug: Celecoxib|Biological: Pembrolizumab|Biological: Recombinant Interferon Alfa-2b|Drug: Rintatolimod","April 16, 2020","Roswell Park Cancer Institute, Buffalo, New York, United States","https://ClinicalTrials.gov/show/NCT04348747"
232,"NCT04395989","An Umbrella Trial Based on Molecular Pathway for Patients With Metastatic TNBC.","Recruiting","No Results Available","TNBC - Triple-Negative Breast Cancer","Drug: A1: Pyrotinib with Capecitabine|Drug: A2: nab-paclitaxel|Drug: B1: everolimus with nab-paclitaxel|Drug: B2: nab-paclitaxel|Drug: C1: PD-1 with nab-paclitaxel and famitinib|Drug: C2: nab-paclitaxel|Drug: D1: VEGFR and nab-paclitaxel|Drug: D2: nab-paclitaxel|Drug: E1: Everolimus with nab-paclitaxel|Drug: E2: nab-paclitaxel","May 20, 2020","Cancer Hospital Affiliated to Fudan University, Shanghai, Shanghai, China","https://ClinicalTrials.gov/show/NCT04395989"
233,"NCT04219072","Clinical Classification of Pain in Breast Cancer Survivors","Recruiting","No Results Available","Chronic Pain|Cancer Pain|Breast Cancer",,"January 6, 2020","KutahyaMSU, Kütahya, Kutahya Health Sciences University, Turkey","https://ClinicalTrials.gov/show/NCT04219072"
234,"NCT04365803","Histology VABB-Histology Post Surgery Pilot Project (BETTY Trial)","Recruiting","No Results Available","Breast Cancer","Procedure: vacuum-assisted breast biopsy","April 28, 2020","European Instituto of Oncology, Milan, Italy","https://ClinicalTrials.gov/show/NCT04365803"
235,"NCT04379024","Pilot Study of Effects of Duavee® on Imaging and Blood Biomarkers In Women With Menopausal Symptoms","Recruiting","No Results Available","Focus of Study is Healthy Women at Risk for Breast Cancer","Drug: DUAVEE 0.45Mg-20Mg Tablet","May 7, 2020","University of Kansas Medical Center, Kansas City, Kansas, United States","https://ClinicalTrials.gov/show/NCT04379024"
236,"NCT04297384","Breast Cancer Pathways Program Impact on Patient Shared Decision Making and Experience in Academic and Community Practice","Recruiting","No Results Available","Anatomic Stage IV Breast Cancer AJCC v8|Breast Carcinoma|Metastatic Breast Carcinoma|Prognostic Stage IV Breast Cancer AJCC v8|Recurrent Breast Carcinoma","Other: Informational Intervention|Other: Quality-of-Life Assessment|Other: Survey Administration","March 5, 2020","Roswell Park Cancer Institute, Buffalo, New York, United States","https://ClinicalTrials.gov/show/NCT04297384"
237,"NCT04436809","Sentinel Node Biopsy Alone or With Axillary Dissection After Primary Chemotherapy","Completed","No Results Available","Breast Neoplasm Female","Procedure: Sentinel Node Biopsy|Procedure: Axillary Dissection","June 18, 2020",,"https://ClinicalTrials.gov/show/NCT04436809"
238,"NCT04360941","PAveMenT: Palbociclib and Avelumab in Metastatic AR+ Triple Negative Breast Cancer","Not yet recruiting","No Results Available","Triple Negative Breast Cancer|Locally Advanced Breast Cancer|Recurrent Breast Cancer|Metastatic Breast Cancer|ER+ Breast Cancer|HER2-positive Breast Cancer","Drug: Palbociclib|Drug: Avelumab","April 24, 2020","Royal Marsden NHS Foundation Trust, London, United Kingdom","https://ClinicalTrials.gov/show/NCT04360941"
239,"NCT04233385","Myofascial Massage for Pain and Immobility Following Breast Cancer Surgery","Recruiting","No Results Available","Breast Cancer|Mastectomy; Lymphedema|Pain, Shoulder|Mobility Limitation","Other: Myofascial Massage|Other: Light Touch","January 18, 2020","MetroHealth Medical Center, Cleveland, Ohio, United States","https://ClinicalTrials.gov/show/NCT04233385"
240,"NCT04241237","Concordance Between Liquid and Tissue Biopsy","Not yet recruiting","No Results Available","Breast Neoplasms","Procedure: Blood Draw","January 27, 2020","London Regional Cancer Program, London, Ontario, Canada","https://ClinicalTrials.gov/show/NCT04241237"
241,"NCT04418219","A Breast Cancer Vaccine (SV-BR-1-GM) in Combination With Pembrolizumab for the Treatment of Persistent, Recurrent, or Metastatic Breast Cancer","Not yet recruiting","No Results Available","Anatomic Stage IV Breast Cancer AJCC v8|Metastatic Breast Carcinoma|Prognostic Stage IV Breast Cancer AJCC v8|Recurrent Breast Carcinoma|Refractory Breast Carcinoma","Drug: Cyclophosphamide|Biological: Allogeneic GM-CSF-secreting Breast Cancer Vaccine SV-BR-1-GM|Biological: Pembrolizumab|Biological: Recombinant Interferon Alpha 2b-like Protein|Other: Questionnaire Administration|Other: Quality of Life Assessment","June 5, 2020","Sidney Kimmel Cancer Center at Thomas Jefferson University, Philadelphia, Pennsylvania, United States","https://ClinicalTrials.gov/show/NCT04418219"
242,"NCT04259905","Pink Warrior 2: Teleconference-based Gaming Support","Recruiting","No Results Available","Breast Cancer|Physical Activity","Behavioral: Active video game teleconference support group|Behavioral: Standard support group + pedometer","February 7, 2020","The University of Texas Medical Branch, Galveston, Texas, United States","https://ClinicalTrials.gov/show/NCT04259905"
243,"NCT04445844","INCMGA00012 and Pelareorep for the Treatment of Metastatic Triple Negative Breast Cancer, IRENE Study","Not yet recruiting","No Results Available","Anatomic Stage IV Breast Cancer AJCC v8|Locally Advanced Breast Carcinoma|Metastatic Triple-Negative Breast Carcinoma|Prognostic Stage IV Breast Cancer AJCC v8|Triple-negative Breast Cancer","Biological: Pelareorep|Other: Quality-of-Life Assessment|Other: Questionnaire Administration|Biological: Retifanlimab","June 24, 2020","Rutgers Cancer Institute of New Jersey, New Brunswick, New Jersey, United States","https://ClinicalTrials.gov/show/NCT04445844"
244,"NCT04305236","Neo-Adjuvant Abemaciclib With Fulvestrant in Patients With ER/PR +HER Negative Breast Cancer","Not yet recruiting","No Results Available","Breast Neoplasm|Hormone Receptor Positive Breast Carcinoma","Drug: Abemaciclib|Drug: Fulvestrant","March 12, 2020","Chao Family Comprehensive Cancer Center, University of California, Irvine, Orange, California, United States","https://ClinicalTrials.gov/show/NCT04305236"
245,"NCT04304404","Risk Reduction Program for Women Having High Risk of Breast Cancer","Active, not recruiting","No Results Available","Cancer Screening|Early Detection of Cancer|Breast Cancer|Preventive Health Care|Health Behavior","Behavioral: Breast Cancer Risk Reduction Program","March 11, 2020","Akdeniz University, Antalya, Turkey","https://ClinicalTrials.gov/show/NCT04304404"
246,"NCT04425018","MARGetuximab Or Trastuzumab (MARGOT)","Not yet recruiting","No Results Available","Breast Cancer|Stage II Breast Cancer|Stage III Breast Cancer|HER2-positive Breast Cancer","Drug: Paclitaxel|Drug: Pertuzumab|Drug: Margetuximab|Drug: Trastuzumab","June 11, 2020","Dana Farber Cancer Institute, Boston, Massachusetts, United States","https://ClinicalTrials.gov/show/NCT04425018"
247,"NCT04270123","An EORTC Study Updating the QLQ-BR23 to BR45","Not yet recruiting","No Results Available","Cancer|Breast Cancer","Other: EORTC QLQ-BR45 questionnaire","February 17, 2020","Leeds Teaching Hospitals NHS Trust, Leeds, West Yorkshire, United Kingdom","https://ClinicalTrials.gov/show/NCT04270123"
248,"NCT04276272","D4 Choline Breast PET/CT","Not yet recruiting","No Results Available","HER2-negative Breast Cancer|ER Positive Breast Cancer|Metastatic Breast Cancer","Other: Imaging scan","February 19, 2020","Imperial College Healthcare NHS Trust/ Imperial College london, London, United Kingdom","https://ClinicalTrials.gov/show/NCT04276272"
249,"NCT04448886","Sacituzumab Govitecan Vs Pembrolizumab In HR+ / HER2 - MBC","Not yet recruiting","No Results Available","Invasive Breast Cancer|Metastatic Breast Cancer|HR-Positive Breast Cancer|HER2-negative Breast Cancer","Drug: Pembrolizumab|Drug: Sacituzumab Govitecan","June 26, 2020","Dana Farber Cancer Institute, Boston, Massachusetts, United States","https://ClinicalTrials.gov/show/NCT04448886"
250,"NCT04265547","Family-Based Intervention Study of the Effects of Environmental Exposures on Breast Tissue Composition","Enrolling by invitation","No Results Available","Breast Cancer Risk","Behavioral: Breast Cancer Risk Reduction Household Intervention","February 11, 2020","Columbia University Mailman School of Public Health, New York, New York, United States","https://ClinicalTrials.gov/show/NCT04265547"
251,"NCT04386629","Health Economy Register","Recruiting","No Results Available","Breast Neoplasms",,"May 13, 2020","Hämato-onkologischer Studienkreis am Klinikum Aschaffenburg, Aschaffenburg, Germany|Kliniken der Stadt Köln - Krankenhaus Holweide, Brustzentrum, Cologne, Germany|Kliniken Essen Mitte, Essen, Germany|Onkology Bethanien Frankfurt, Frankfurt, Germany|Mammazentrum Hamburg Am Krankenhaus Jerusalem, Hamburg, Germany|University Hospital, Mainz, Germany|University Hospital, Mannheim, Germany|University Hospital, München, Germany|Johanna Etienne Krankenhaus, Neuss, Germany|Praxisnetzwerk Hämatologie/ intern. Onkologie, Troisdorf, Germany","https://ClinicalTrials.gov/show/NCT04386629"
252,"NCT04290897","Oxaloacetate for the Improvement of Cognitive Complaints in Stage 0-IIIA Breast Cancer Survivors","Not yet recruiting","No Results Available","Anatomic Stage 0 Breast Cancer AJCC v8|Anatomic Stage I Breast Cancer AJCC v8|Anatomic Stage IA Breast Cancer AJCC v8|Anatomic Stage IB Breast Cancer AJCC v8|Anatomic Stage II Breast Cancer AJCC v8|Anatomic Stage IIA Breast Cancer AJCC v8|Anatomic Stage IIB Breast Cancer AJCC v8|Anatomic Stage IIIA Breast Cancer AJCC v8|Early-Stage Breast Carcinoma|Prognostic Stage 0 Breast Cancer AJCC v8|Prognostic Stage I Breast Cancer AJCC v8|Prognostic Stage IA Breast Cancer AJCC v8|Prognostic Stage IB Breast Cancer AJCC v8|Prognostic Stage II Breast Cancer AJCC v8|Prognostic Stage IIA Breast Cancer AJCC v8|Prognostic Stage IIB Breast Cancer AJCC v8|Prognostic Stage IIIA Breast Cancer AJCC v8","Drug: Anhydrous Enol-oxaloacetate|Other: Questionnaire Administration","March 2, 2020","UCLA / Jonsson Comprehensive Cancer Center, Los Angeles, California, United States","https://ClinicalTrials.gov/show/NCT04290897"
253,"NCT04245657","Factors Affecting Functionality in Breast Cancer Survivors","Recruiting","No Results Available","Breast Cancer|Breast Cancer Female|Breast Cancer Lymphedema|Breast Carcinoma in Situ|Hand Grasp|Pain, Shoulder","Other: Tissue Dielectric Constant Measurement|Other: Muscle strength measurement|Other: Hand-Grip Strength Measurement|Other: Pain Threshold Measurement|Other: International Physical Activity Questionnaire-Short Form (IPAQ-SF)|Other: Fatigue Impact Scale|Other: Disabilities of Arm, Shoulder and Hand Scale (DASH)|Other: Exercise Benefits/ Barriers Scale|Other: Beck Depression Scale","January 29, 2020","İzmir Çiğli State Training Hospital, İzmir, Çiğli, Turkey","https://ClinicalTrials.gov/show/NCT04245657"
